{
  "id": "a1b2c3d4-e5f6-4789-abcd-ef0123456789",
  "organization_id": "f1e2d3c4-b5a6-4978-9012-345678901234",
  "name": "Production API Key",
  "description": "Key for production deployment access",
  "key_prefix": "sk_prod_",
  "scope_type": "ORGANIZATION",
  "scopes": ["credentials:read", "credentials:issue"],
  "deployment_profile_id": null,
  "enabled": true,
  "expires_at": "2027-12-31T23:59:59Z",
  "last_used_at": "2026-06-01T10:30:00Z",
  "created_at": "2026-01-15T09:00:00Z",
  "updated_at": "2026-06-01T10:30:00Z"
}
